책 제목,책 소개글
Madame Bovary (AmazonClassics Edition),"Emma Bovary, daughter of an uneducated farmer and wife of a dull doctor in northern France, harbors a passion for everything beyond her grasp—sophistication, romance, love, and deliverance from her banal provincial life. Motivated by the primal, idealized, and vain, she seeks adventure. And with each new endeavor, Emma sets for herself an inevitable and inescapable trap.
Condemned as an affront to public morals, Madame Bovary’s obscenity trial made it notorious. Today, Emma stands as one of fiction’s most famous figures, and the novel itself, among the most pioneering and influential in world literature.
AmazonClassics brings you timeless works from the masters of storytelling. Ideal for anyone who wants to read a great work for the first time or rediscover an old favorite, these new editions open the door to literature’s most unforgettable characters and beloved worlds."
The Sun Also Rises (AmazonClassics Edition),"In the aftermath of the First World War, Paris offers a liberating waystation for expatriate newspaperman Jake Barnes. Jake is a casualty of the war, and his disillusionment would be complete were it not for his relationship with the fast-living, twice-divorced Englishwoman Brett Ashley. Along with a small collection of other dissolute expats, Jake and Brett travel from the cafés of Paris to the wild fiestas of Pamplona on a desperate quest for fulfillment.
The Sun Also Rises paints a vivid portrait of a generation just beginning to grapple with the emotional and spiritual fallout of war, and it remains one of Ernest Hemingway’s most moving and captivating works."
The Invisible Man (AmazonClassics Edition),"Having devoted his studies to optics and refraction, an impulsive scientist named Griffin has rendered himself invisible. Unable to reverse the effects, his struggle to survive grows desperate until he realizes that there are benefits to living out of the public eye. Increasingly isolated, he soon spirals into a life of crime and degenerates into madness. He can’t see that he has become his own worst enemy.
Exploring the loss of identity and the willful disappearance of conscience and morality, H. G. Wells crafted one of his most suspenseful and cautionary tales, which continues to intrigue to this day.
AmazonClassics brings you timeless works from the masters of storytelling. Ideal for anyone who wants to read a great work for the first time or rediscover an old favorite, these new editions open the door to literature’s most unforgettable characters and beloved worlds."
Journey to the Center of the Earth (AmazonClassics Edition),"A sixteenth-century cryptogram spurs modern geologist Otto Liedenbrock to embark on the most remarkable human quest ever taken. With his nephew and guide, he leads the descent from a dormant Icelandic volcano into the unexplored realm beneath their feet. There, a vast subterranean ocean, prehistoric creatures, and natural phenomena are but a few of the wonders hidden from all but the boldest eyes.
Journey to the Center of the Earth epitomizes the subterranean fiction genre. Author Jules Verne leads readers deep below the world’s surface to the core of his inventive, visionary mind.
AmazonClassics brings you timeless works from the masters of storytelling. Ideal for anyone who wants to read a great work for the first time or rediscover an old favorite, these new editions open the door to literature’s most unforgettable characters and beloved worlds."
Beyond Good and Evil (AmazonClassics Edition),"A caustic criticism of nearly every philosophic predecessor and a challenge of traditionally held views on right and wrong, Friedrich Nietzsche’s Beyond Good and Evil paved the way for modern philosophical thought. Through nearly three hundred transformative aphorisms, Nietzsche presents a worldview in which neither truth nor morality are absolutes, and where good and evil are not opposites but counterparts that stem from the same desires.
Beyond Good and Evil was a foundational text for early twentieth-century thinkers, including philosophers, psychologists, novelists, and playwrights. Today’s readers will delight in Nietzsche’s pithy wit and irony while gaining a deeper understanding of his core ideology.
AmazonClassics brings you timeless works from iconic authors. Ideal for anyone who wants to read a great work for the first time or revisit an old favorite, these new editions open the door to the stories and ideas that have shaped our world."
Mansfield Park (AmazonClassics Edition),"After her impoverished family sends her to live with her wealthy aunt and uncle at opulent Mansfield Park, Fanny Price finds her life forever changed by the aristocratic Bertrams and the city-dwelling Crawford siblings. But is it for the better? While the others seem content to abandon what’s right to further their own interests, Fanny decides to hold true to her heart—a choice that will make or break her future.
Mansfield Park is largely considered to be one of Jane Austen’s most ambitious novels, a darkly satirical glimpse into morality and social mobility within the nineteenth-century British class system.
AmazonClassics brings you timeless works from the masters of storytelling. Ideal for anyone who wants to read a great work for the first time or rediscover an old favorite, these new editions open the door to literature’s most unforgettable characters and beloved worlds."
The Brothers Karamazov (AmazonClassics Edition),"The Karamazov brothers are as different as mind, body, and spirit. Ivan, an atheist and brooding intellectual; Dmitri, a volatile sensualist and his father’s rival for the beautiful Grushenka; and Alexey, driven by unshakeable piety. In their shadow is their rejected half-brother, humiliated into servitude. Together they act to rid themselves of the dissolute Karamazov patriarch. Then, in a single shocking act, the fates of the brothers are inexorably altered.
Delving into debates about God, free will, faith, doubt, and moral responsibility, The Brothers Karamazov is Fyodor Dostoyevsky’s profound pioneering masterpiece of psychological realism."
Northanger Abbey (AmazonClassics Edition),"Seventeen-year-old Catherine Morland excitedly accepts an offer to accompany family friends on a trip to Bath. There, Catherine makes new acquaintances who invite her to Northanger Abbey, and she encounters a world she’d only glimpsed in the pages of her beloved gothic novels. Through Catherine’s eyes, the Abbey is full of mystery, suspense, and adventure; and she is the heroine at the center of it all. As her imagination begins to run wild, she imperils her summer, her new friendships, and her burgeoning relationship with the charming Henry Tilney.
Both a satire of gothic fiction and a coming-of-age story, Northanger Abbey is widely regarded as one of Jane Austen’s most comedic works.
AmazonClassics brings you timeless works from the masters of storytelling. Ideal for anyone who wants to read a great work for the first time or rediscover an old favorite, these new editions open the door to literature’s most unforgettable characters and beloved worlds."
The Adventures of Tom Sawyer (AmazonClassics Edition),"Whether he’s sneaking doughnuts, mooning over a pretty girl, or snookering the local boys to do his work for him, Tom Sawyer is the consummate schemer—but his charm and easygoing nature keep him from being in anyone’s bad graces for long. However, when Tom teams up with his friend Huck Finn, their sleepy Missouri town had better watch out.
Based on Mark Twain’s memories of growing up along the Mississippi River, The Adventures of Tom Sawyer is both an idyllic picture of boyhood and an affectionate satire of adult conventions.
AmazonClassics brings you timeless works from the masters of storytelling. Ideal for anyone who wants to read a great work for the first time or rediscover an old favorite, these new editions open the door to literature’s most unforgettable characters and beloved worlds."
The Federalist Papers (AmazonClassics Edition),"Hailed by Thomas Jefferson as “the best commentary on the principles of government which was ever written,” The Federalist Papers is a collection of eighty-five essays published by Founding Fathers Alexander Hamilton, James Madison, and John Jay from 1787 to 1788, as a means to persuade the public to ratify the Constitution of the United States.
With nearly two-thirds of the essays written by Hamilton, this enduring classic is perfect for modern audiences passionate about his work or seeking a deeper understanding of one of the most important documents in US history.
AmazonClassics brings you timeless works from iconic authors. Ideal for anyone who wants to read a great work for the first time or revisit an old favorite, these new editions open the door to the stories and ideas that have shaped our world."
Oliver Twist (AmazonClassics Edition),"Orphaned at birth to labor in a workhouse, Oliver Twist is barely ten when he flees for London. There he befriends young Jack Dawkins, who educates the innocent Oliver in the ways of survival. When Jack draws Oliver into a gang of juvenile pickpockets, tutored by the unscrupulous Fagin, Oliver’s corruptive influences grow. But for a boy taught only wrong, Oliver must hold on to what he knows is right.
In Oliver Twist, Charles Dickens furiously condemns the realities of nineteenth-century England and rewards those who can escape them still pure at heart.
AmazonClassics brings you timeless works from the masters of storytelling. Ideal for anyone who wants to read a great work for the first time or rediscover an old favorite, these new editions open the door to literature’s most unforgettable characters and beloved worlds."
The Communist Manifesto (AmazonClassics Edition),"With its message of working-class empowerment and call for unity, The Communist Manifesto endures as one of history’s most influential, visionary, and controversial documents. Intending to rouse readers from their indifference, authors Karl Marx and Friedrich Engels demanded the end of proletariat exploitation and called for the overthrow of the oppressive bourgeois ruling class. It was a blueprint for an uncompromising new direction that would serve as the spark for the socialist uprising in the late 1800s.
Today, The Communist Manifesto reverberates fully and fittingly in the polarized political climate of the twenty-first century."
Macbeth (AmazonClassics Edition),"One night on the heath, the brave and respected general Macbeth encounters three witches who foretell that he will become king of Scotland. At first skeptical, he’s urged on by the ruthless, single-minded ambitions of Lady Macbeth, who suffers none of her husband’s doubt. But seeing the prophecy through to the bloody end leads them both spiraling into paranoia, tyranny, madness, and murder.
This shocking tragedy—a violent caution to those seeking power for its own sake—is, to this day, one of Shakespeare’s most popular and influential masterpieces.
AmazonClassics brings you timeless works from the masters of storytelling. Ideal for anyone who wants to read a great work for the first time or rediscover an old favorite, these new editions open the door to literature’s most unforgettable characters and beloved worlds."
Notes from the Underground (AmazonClassics Edition),"Isolated from society in a tenement basement in St. Petersburg, a malicious former civil servant vents his resentments. In the rambling notes that follow, we are exposed to the inner turmoil of the Underground Man, who represents the voice of his generation. An emotional, paranoid knot of contradictions, the spiteful narrator is also desperate to join a society he loathes, if only to prove his superiority to it.
Exploring themes of free will versus determinism, Dostoyevsky’s existential exploration was written to challenge increasingly popular Western egoist philosophies. In the Underground Man, he found the embodiment of the antihero, whose behavior—like all human behavior—defies rationalization.
AmazonClassics brings you timeless works from the masters of storytelling. Ideal for anyone who wants to read a great work for the first time or rediscover an old favorite, these new editions open the door to literature’s most unforgettable characters and beloved worlds."
David Copperfield (AmazonClassics Edition),"After his childhood is turned upside down, orphan David Copperfield is forced to navigate and survive the brutal world of the industrial poor. He’ll cross classes and paths with kindred spirits, extended family, eccentrics, and adversaries. Throughout his journey into adulthood, he’ll be befriended, loved, and conspired against. And each evolving adventure—comic, tragic, and romantic, both at home and abroad—will inform the observant young man’s success as he becomes a novelist.
In his most autobiographical work—the one he considered his “favorite child”—Charles Dickens etched a gallery of indelible characters, including the cruel Murdstone, the recklessly optimistic Micawber, the devious Uriah Heep, and Dora and Agnes, the faithful loves of David’s life. Enduringly popular, David Copperfield is considered by many to be Dickens’s masterpiece."
Paradise Lost (AmazonClassics Edition),"In Paradise, God’s favored new creations—Adam and Eve—live in bliss, untainted by sin. In another realm, Satan and his banished rebel angels collude to destroy God’s tranquil new design. Into this idyll called Earth, and the confidence of Adam and Eve, Satan will instigate the fall of man.
At the heart of this complex, audacious epic poem is a drama driven by the most recognizable human flaws. More than a story from Genesis, it is the extraordinary expression of Milton’s search for personal truth and the meaning of existence, written to “justify the ways of God to men.”
AmazonClassics brings you timeless works from the masters of storytelling. Ideal for anyone who wants to read a great work for the first time or rediscover an old favorite, these new editions open the door to literature’s most unforgettable characters and beloved worlds."
The Wonderful Wizard of Oz (AmazonClassics Edition),"Swept away by a cyclone from the Kansas prairies to the Land of Oz, Dorothy and her dog, Toto, must find their way home. Traveling to the Emerald City with a new band of friends—the Scarecrow, the Tin Woodman, and the Cowardly Lion—Dorothy’s fate is in the hands of a great and terrible wizard. But a wicked enemy stands in her way.
For readers familiar only with the iconic 1939 film, delightful surprises are in store along Baum’s original yellow brick road. Considered “America’s first fairy tale,” The Wonderful Wizard of Oz has found a home in the collective imagination of the entire world."
The Metamorphosis (AmazonClassics Edition),"One morning, traveling salesman Gregor Samsa wakes from an anxious dream to discover that he has inexplicably changed into a monstrous insect. Nonetheless, life goes on, and poor Gregor is left to deal not only with the existential questions of who or what he now is but also with more mundane concerns: his job (which he fears he’ll lose), his loved ones (whom he fears he disgusts), and the daily indignities of everyday life (which continue apace). Soon, even those who sympathize with his bizarre predicament begin to lose their patience…
A darkly comic examination of social mores, family dynamics, and the nature of identity itself, Kafka’s unsettling masterpiece has inspired a century of literary debate and interpretive theories. But its enduring power lies in the simplicity of its audacious premise, its deadpan surrealism, and its humane sensitivity."
Heidi (AmazonClassics Edition),"Filled with the power of love and the beauty of nature, Heidi is a lyrical tale about a little girl sent to live in the mountains of the Swiss Alps with her grandfather. A grumpy recluse, her grandfather has isolated himself from his fellow townspeople and his church. In very little time, Heidi warms his heart; and she quickly charms the whole town and makes new friends, including young Peter, the goatherd. But when Heidi is sent away again to care for a young girl her own age, she must grow wise beyond her years, learning invaluable lessons that she will impart to others to better their lives.
In her best-known book, Johanna Spyri portrays how a child’s radiant joy and simple faith can transform the world around her.
AmazonClassics brings you timeless works from the masters of storytelling. Ideal for anyone who wants to read a great work for the first time or rediscover an old favorite, these new editions open the door to literature’s most unforgettable characters and beloved worlds."
Romeo and Juliet (AmazonClassics Edition),"When the feud between the Montagues and Capulets spills into the streets of Verona, a great love must be kept secret—that of Romeo, son of Montague, and Juliet, daughter of the sworn enemy. But only a tragic twist of fate can promise peace.
When Shakespeare staged Romeo and Juliet in 1594, it was already a centuries-old Italian tale that had been translated and adapted in verse and prose by a number of poets and storytellers. Out of the common threads of those now-forgotten works, Shakespeare created not only one of his most popular plays, but one that would become the archetypal love story of the English language."
The Republic (AmazonClassics Edition),"What is justice? In Plato’s Socratic dialogue, The Republic, the citizens of ancient Greece explore the world’s most fundamental question.
In search of an ideal civilization, Socrates leads Glaucon, Polemarchus, Thrasymachus, and others in debates about various subjects, including justice, truth, class, and art. For without righteousness, tyranny and injustice give rise to oligarchy.
The influential dialogues of The Republic helped shape all of Western literature and philosophical thought. It is as much a doctrine of ethics and politics now as it was for the ancient Greeks, and its dilemma remains: how to create a perfect society populated by very imperfect human beings.
AmazonClassics brings you timeless works from the masters of storytelling. Ideal for anyone who wants to read a great work for the first time or rediscover an old favorite, these new editions open the door to literature’s most unforgettable characters and beloved worlds."
Anne of Green Gables (AmazonClassics Edition),"Eleven-year-old orphan Anne Shirley has just arrived at Green Gables, and already her guardians want to send her back. First, she’s not the boy the Cuthberts expected. Second, she talks too much. And even with her generous spirit, the redhead’s a trouble magnet. She gets the neighbor drunk and nearly poisons the pastor!
Still, despite a rocky start, the fiery Anne wins over her guardians and her new community. She enjoys life at Green Gables, excels in school, and earns a coveted scholarship. But when tragedy hits, Anne must choose between her dreams and the only home she’s ever known.
In this beloved coming-of-age story, Lucy Maud Montgomery drew from her own experiences growing up in Canada during the nineteenth century to introduce generations of readers to one of literature’s most original and inspiring characters.
AmazonClassics brings you timeless works from the masters of storytelling. Ideal for anyone who wants to read a great work for the first time or rediscover an old favorite, these new editions open the door to literature’s most unforgettable characters and beloved worlds."
Twelve Years a Slave (AmazonClassics Edition),"Born into “the blessings of liberty in a free State,” Solomon Northup was kidnapped and sold into slavery in the Bayou Boeuf region of Louisiana’s Red River Valley. Twelve Years a Slave is the chronicle of his captivity at the mercy of sadistic plantation owner Edwin Epps, who tested Northup’s tenacity and self-control under the most brutal conditions. Until fate brought a Canadian abolitionist to Epps’s farm, Northup thought he would never draw another free breath.
To this day Northup’s harrowing memoir is recognized as the most reliable, accurate eyewitness account of the daily lives of slaves. As a significant historical reference, it is unsurpassed. As an authentic narrative of a man starved of his freedom, it is unforgettable.
AmazonClassics brings you timeless works from iconic authors. Ideal for anyone who wants to read a great work for the first time or revisit an old favorite, these new editions open the door to the stories and ideas that have shaped our world."
A Little Princess (AmazonClassics Edition),"To prepare his daughter, Sara, for society, wealthy widower Captain Ralph Crewe enrolls her in Miss Minchin’s Select Seminary for Young Ladies. Unspoiled and genial, Sara is given all the luxuries her father can afford—and the obsequious Miss Minchin is happy to indulge. But when her father dies and his fortune is lost, Sara is forced into servitude, stripped of her privileges and possessions, and subjected to Miss Minchin’s true cruel nature.
But as A Little Princess proves, with cleverness, resilience, selfless goodwill, and true friends, a child can be rewarded with infinite riches.
AmazonClassics brings you timeless works from the masters of storytelling. Ideal for anyone who wants to read a great work for the first time or rediscover an old favorite, these new editions open the door to literature’s most unforgettable characters and beloved worlds."
The Adventures of Sherlock Holmes (AmazonClassics Edition),"What made Sherlock Holmes a household name and cultural icon? This very first collection of stories featuring the astute sleuth and his loyal assistant, Dr. Watson. In these twelve ingenious mysteries, Holmes is embroiled in betrayal, abduction, thievery, deception, and murder. Relying on logic, driven by instinct, and employing his uncanny powers of observation, Holmes cracks the cases that elude Scotland Yard. For him, it’s rather elementary.
This Baker Street dozen by Sir Arthur Conan Doyle is all the evidence readers will need to understand why Sherlock Holmes is an enduring legend in detective fiction."
A Connecticut Yankee in King Arthur's Court (AmazonClassics Edition),"After Hank Morgan of Hartford, Connecticut, takes a blow to the head, he inexplicably awakens in sixth-century Camelot. At first lost and confused, the time traveler soon realizes that he can use modern knowledge and his ability to foretell the future to his advantage. Consequently, he is granted a place in the king’s court as Arthur’s right-hand man. When the Catholic Church grows fearful of his power, the Connecticut Yankee aims higher and concocts a grandiose plan to bring American ideals to sixth-century England to change the future.
In his imaginative comedy, Mark Twain infuses the eternal story of King Arthur with wit and satirizes past social hierarchies as well as nineteenth-century meritocracy.
AmazonClassics brings you timeless works from the masters of storytelling. Ideal for anyone who wants to read a great work for the first time or rediscover an old favorite, these new editions open the door to literature’s most unforgettable characters and beloved worlds."
Anna Karenina (AmazonClassics Edition),"Beautiful, popular, and fortunate, Anna Karenina is an upright wife and mother. But her passionless marriage to a senior statesman leads her into the arms of Count Alexey Vronsky. The dashing cavalry officer stokes in her something exciting and defiant. In abandoning the rules of her noble station, she’s aware of the risks: a degraded reputation and the hostile recriminations of St. Petersburg society. But there are even greater stakes as Anna follows desires both romantic and carnal, emancipating and destructive.
The embodiment of the clash between Russia’s old-world tradition and its liberal reform, Leo Tolstoy’s willful heroine remains one of the most notorious and tragic in all of world literature."
Tarzan of the Apes (AmazonClassics Edition),"John Clayton III, an orphan boy, comes of age in the western coastal jungles of Africa following the tragic deaths of his aristocratic parents. Raised in the ways of the apes by his adoptive mother, Kala, he is renamed Tarzan and ascends to king through feats of revenge and courage.
When a group of explorers brings the beautiful Jane Porter to the jungle, a lovelorn Tarzan decides to follow her to the United States to win her love. On his journey back into human society, Tarzan must decide whether to return to the jungle or reclaim his past.
Fast-paced and suspenseful, Tarzan of the Apes was wildly successful and generated two dozen sequels; and many film, radio, and comic-book adaptations.
AmazonClassics brings you timeless works from the masters of storytelling. Ideal for anyone who wants to read a great work for the first time or rediscover an old favorite, these new editions open the door to literature’s most unforgettable characters and beloved worlds."
