책 제목,책 소개글
Wuthering Heights (AmazonClassics Edition),"Raised together on the Yorkshire moors, Heathcliff and Catherine become lovers and soul mates so utterly inseparable that their destiny seems inevitable. But when Catherine’s desire for social status results in her marriage to Heathcliff’s wealthy rival, Heathcliff is consumed by revenge. And no one in his path will be spared.
Admired for its stark originality and condemned for its fiendish affront to the senses, Wuthering Heights polarized critics. For generations of readers since, its themes of gender inequality, religious hypocrisy, social climbing, and the violent extremes of romantic obsession resonate to this day."
Pride and Prejudice (AmazonClassics Edition),"Love is in the air when five sisters discover that a wealthy and eligible bachelor is suddenly within reach. But it is his friend, the haughty Mr. Darcy, who becomes smitten. Unfortunately for him, the object of his affection is not so easily swayed.
One of the most popular characters in English literature, Elizabeth Bennet is intelligent, witty, well-spoken and ahead of her time. If the terrible rumors about Mr. Darcy are true, he doesn’t stand a chance. Yet not all gossip is to be believed when marriage, money, and reputations are on the line. Will Elizabeth and Mr. Darcy circumvent her haste, his ego, and society’s expectations to find love?
Written more than two centuries ago, Jane Austen’s enduring story of manners, family, and love continues to delight new generations of readers.
AmazonClassics brings you timeless works from the masters of storytelling. Ideal for anyone who wants to read a great work for the first time or rediscover an old favorite, these new editions open the door to literature’s most unforgettable characters and beloved worlds."
Dracula (AmazonClassics Edition),"Young lawyer Jonathan Harker journeys to Transylvania to meet with the mysterious Count Dracula only to discover that his nobleman client is a vampire who is thirsty for new blood. After imprisoning Harker in his castle, Dracula travels to England to seduce Jonathan’s fiancée, Mina, and the battle against an ineffable evil begins.
Led by philosopher and metaphysician Professor Van Helsing—Dracula’s most indomitable adversary—Harker, Mina, and a band of allies unite, determined to confront and destroy the Count before he can escape.
Bram Stoker ingeniously modernized gothic folklore by moving his vampire from traditional castle ruins to modern England. With Dracula, which has been interpreted and dissected by scholars for generations, Stoker changed the vampire novel forever."
The Picture of Dorian Gray (AmazonClassics Edition),"In the wealthy and vain hedonist Dorian Gray, London painter Basil Hallward has found his muse. Only when the portrait of Dorian begins to age, while the man himself remains untouched by time, do they realize they may have made a deal with the devil.
Oscar Wilde’s only novel takes a witty, philosophical, and harrowing look at our obsession with youth and the price we pay for it."
War and Peace (AmazonClassics Edition),"In early nineteenth-century Russia, the threat of Napoleon’s invasion looms, and the lives of millions are about to be changed forever. This includes Pierre Bezúkhov, illegitimate son of an aristocrat; Andrew Bolkónski, ambitious military scion; and Natásha Rostóva, compassionate daughter of a nobleman. All of them are unprepared for what lies ahead. Alongside their fellow compatriots—a catalog of enduring literary characters—Pierre, Andrew, and Natásha will be irrevocably torn between fate and free will.
Through the bonds of love and family, and all that can break them, Tolstoy examines the effects of war on every strata of society in his masterwork of intimate—and epic—social history."
Frankenstein (AmazonClassics Edition),"Obsessed with the secret of creation, Swiss scientist Dr. Victor Frankenstein cobbles together a body he’s determined to bring to life. And one fateful night, he does. When the creature opens his eyes, the doctor is repulsed: his vision of perfection is, in fact, a hideous monster. Dr. Frankenstein abandons his creation, but the monster won’t be ignored, setting in motion a chain of violence and terror that shadows Victor to his death.
Mary Shelley’s Frankenstein, a gripping story about the ethics of creation and the consequences of trauma, is one of the most influential Gothic novels in British literature. It is as relevant today as it is haunting."
The Count of Monte Cristo (AmazonClassics Edition),"After fourteen years of wrongful imprisonment, merchant sailor Edmond Dantès escapes his grim island fortress. With the promises of youth erased and his betrothed now married to someone else, Dantès lives for one purpose: revenge. Thanks to a benevolent prison confidante who reveals the location of a hidden treasure, Dantès buys his way, unrecognized, into society. Adopting a new identity as the Count of Monte Cristo, he sets out to destroy the rivals who framed him for treason. But the count’s obsessive quest could have irrevocable consequences for the innocent—and for himself.
What unfolds is an epic tale of breathtaking intrigue and righteous retribution from Alexandre Dumas, the nineteenth-century master of high adventure."
The Adventures of Huckleberry Finn (AmazonClassics Edition),"Refusing to be civilized by Southern society or cowed by his drunken father’s lashings, young Huckleberry Finn decides he has only one option left: fake his own death and hop a raft down the Mississippi River. Instead of carrying him far from trouble, though, Huck’s raft delivers him to a place of moral uncertainty.
Mark Twain unwinds Huck’s harrowing journey to manhood with satirical wit, revealing the troubled history of the American South, where slavery held sway long after the Civil War ended. Huck’s relationship with runaway slave Jim forces him to confront his beliefs about friendship and freedom.
AmazonClassics brings you timeless works from the masters of storytelling. Ideal for anyone who wants to read a great work for the first time or rediscover an old favorite, these new editions open the door to literature’s most unforgettable characters and beloved worlds."
Little Women (AmazonClassics Edition),"As a New England mother struggles to support her family in the wake of her husband’s service in the Civil War, her four daughters struggle, too—caught between childhood dreams and the realities of burgeoning adulthood. For Meg, Jo, Beth, and Amy March, raised in integrity and virtue, negotiating the right path in life means making choices that will either narrow or expand their destinies.
Based on the author’s life, Little Women transcends genre, gender, and class with its examination of personal quests, societal restrictions, family ties, and the end of innocence.
AmazonClassics brings you timeless works from the masters of storytelling. Ideal for anyone who wants to read a great work for the first time or rediscover an old favorite, these new editions open the door to literature’s most unforgettable characters and beloved worlds."
Crime and Punishment (AmazonClassics Edition),"Living in a squalid room in St. Petersburg, the indigent but proud Rodion Raskolnikov believes he is above society. Obsessed with the idea of breaking the law, Raskolnikov resolves to kill an old pawnbroker for her cash.
Although the murder and robbery are bungled, Raskolnikov manages to escape without being seen. And with nothing to prove his guilt and a mendacious confessor in police custody, Raskolnikov seems to have committed the perfect crime. But in Fyodor Dostoyevsky’s world of moral transgressions, with its reason and its consequences, Raskolnikov’s plan has a devastating hitch: the feverish delirium of his own conscience.
AmazonClassics brings you timeless works from the masters of storytelling. Ideal for anyone who wants to read a great work for the first time or rediscover an old favorite, these new editions open the door to literature’s most unforgettable characters and beloved worlds. "
Moby Dick (AmazonClassics Edition),"Ignoring prophecies of doom, the seafarer Ishmael joins the crew of a whaling expedition that is an obsession for the ship’s captain, Ahab. Once maimed by the White Whale, Moby Dick, Ahab has set out on a voyage of revenge. With godlike ferocity, he surges into dangerous waters—immune to the madness of his vision, refusing to be bested by the forces of nature.
An exhilarating whaling yarn, an apocalyptic theodicy, a tragic confessional, and a profound allegory, Moby Dick encompasses all that it means to be human—from the physical and metaphysical to the spiritual and emotional. Full of strange wisdom and wild digressive energy, it’s a singular literary performance universally regarded as one of the great American novels."
The Arabian Nights (AmazonClassics Edition),"The vengeful King Schahriar agrees to stave off the execution of Queen Scheherazade until she finishes a particularly compelling story. Her plan? Bleed one tale into another. Through fanciful histories, romances, tragedies, comedies, poems, riddles, and songs, Scheherazade prolongs her life by holding the king’s rapt attention.
With origins in Persian and Eastern Indian folklore, the stories of The Arabian Nights have been reworked, reshaped, revised, collected, and supplemented throughout the centuries by various authors and scholars—and are continually redefined by the modern translations of the Western world.
AmazonClassics brings you timeless works from the masters of storytelling. Ideal for anyone who wants to read a great work for the first time or rediscover an old favorite, these new editions open the door to literature’s most unforgettable characters and beloved worlds."
The Phantom of the Opera (AmazonClassics Edition),"A phantom has haunted the Paris Opera House for years. Now he is infatuated with singer Christine Daaé. Despite an astonishing debut performance, Christine fails to win the lead in Faust, and the Phantom’s cursed retaliation on the opera house is spectacularly fatal. As the chandelier falls, he kidnaps Christine, and through hidden passages and behind trapdoors, shares his life story with her. To secure her escape, Christine promises to stay true to him forever. But when the Phantom learns of the prima donna’s intention to flee, his passion turns terrifying.
With its complex and victimized antihero, a man at once evil and misjudged, Gaston Leroux’s Grand Guignol has become a fixture of romantic popular culture and the dark absolute of obsessive love.
AmazonClassics brings you timeless works from the masters of storytelling. Ideal for anyone who wants to read a great work for the first time or rediscover an old favorite, these new editions open the door to literature’s most unforgettable characters and beloved worlds."
The Odyssey (AmazonClassics Edition),"After enduring the Trojan War, Odysseus begins the treacherous journey home to Ithaca. On the way, he faces ravenous monsters and vengeful gods. But the real battle awaits, as his kingdom is under siege by unruly suitors vying for his wife’s hand—and his son’s head. To reclaim his throne and save his family, Odysseus must rely on his wits…and help from the unpredictable gods.
Homer’s The Odyssey was composed around 700 BC. It is one of the earliest epics in existence and remains one of the most influential works of literature today."
The Great Gatsby (AmazonClassics Edition),"Four years after the Great War, America is enjoying an economic boom. Enigmatic veteran Jay Gatsby, who’s risen from being nobody from nowhere to self-made millionaire, is along for the ride. Upwardly mobile, he reaches for status among the “old money” on Long Island—and for all that it promises across the bay, namely Daisy, the lost love of his youth, who has been married for five years to Gatsby’s contemptible rival, Tom Buchanan. With all his wealth and charmed aspirations to restore the past, Gatsby is certain he can win her back. But halfway between the skyscrapers of Manhattan and the mansions of West Egg lies the “valley of ashes,” where Gatsby’s glittering world is turned upside down.
The Great Gatsby remains the quintessential embodiment of the reckless idealism of the Jazz Age and the disenchanting search for the American Dream."
The Secret Garden (AmazonClassics Edition),"The orphaned Mary Lennox is sullen, ill tempered, and unloved when she’s sent to live with her uncle, Archibald Craven. A man consumed by grief over the death of his wife, Archibald has allowed his sprawling estate on the moors to fall into grim disrepair. It’s when Mary begins tending to her late aunt’s mysterious garden—locked up and neglected for years—that she discovers its life-changing secrets and a flowering rejuvenation of the human spirit.
Out of this dark, closed-off world and a child’s innate curiosity about life and death comes one of the most transformative coming-of-age novels ever written."
Persuasion (AmazonClassics Edition),"Seven years ago, Anne Elliot broke off her engagement to Captain Frederick Wentworth, convinced that marrying a man without money or status would be a grave mistake. Now, she is past her prime and single at twenty-seven. But when the estranged paramours reconnect through a couple renting the Elliot family estate, Anne discovers she may have another shot at romance—this time, on her terms.
Part fairy tale, part social commentary, Jane Austen’s novel delivers not only her signature warmth and wit but perhaps her most mature and relatable heroine. Persuasion remains true to Austen’s form in being ahead of its time, arguing that where there is love, there is happiness—even in the most impractical of unions.
AmazonClassics brings you timeless works from the masters of storytelling. Ideal for anyone who wants to read a great work for the first time or rediscover an old favorite, these new editions open the door to literature’s most unforgettable characters and beloved worlds."
The Art of War (AmazonClassics Edition),"Long considered the most essential treatise on military strategy and tactics, The Art of War comprises thirteen chapters, each dedicated to a different aspect of warfare. Reaching far beyond the battlefield, it is a manifesto for success in every kind of conflict or competition, having had a notable influence on various subjects such as law, sports, and interpersonal relationships.
In this definitive 1910 Lionel Giles translation, the celebrated sinologist’s interpretive notes and valuable commentary make clear the nuances of Sun Tzu’s language. Most critical, Giles provides the context and culture from which the general’s theories emerged."
Sense and Sensibility (AmazonClassics Edition),"After the death of their father, sisters Elinor and Marianne Dashwood face financial ruin. At the mercy of their half brother, John, and his greedy wife, their only hope is to make a good match. But reduced circumstances make courtship difficult—especially after being turned out of their home. While responsible Elinor takes a practical approach to matters of the heart, Marianne throws herself in unreservedly.
In Jane Austen’s first novel, two of literature’s most iconic characters discover that love demands a balance of passion and pragmatism.
AmazonClassics brings you timeless works from the masters of storytelling. Ideal for anyone who wants to read a great work for the first time or rediscover an old favorite, these new editions open the door to literature’s most unforgettable characters and beloved worlds."
Emma (AmazonClassics Edition),"Charming, rich, and clever, heiress Emma Woodhouse has no need for an occupation—or a husband. Still, she considers herself quite skilled at matchmaking. Although her dear friend Mr. Knightley advises against it, there is nothing that she enjoys more than entangling herself in the romantic lives of others. But when one of her well-intentioned plans goes awry—as Mr. Knightley rightly predicted—Emma must face the consequences of her meddling.
The delightfully imperfect Emma and her Mr. Knightley have captured the hearts of generations of readers. A lively comedy of manners that has been adapted several times for the screen, Emma is the last work Jane Austen lived to see published.
AmazonClassics brings you timeless works from the masters of storytelling. Ideal for anyone who wants to read a great work for the first time or rediscover an old favorite, these new editions open the door to literature’s most unforgettable characters and beloved worlds."
Jane Eyre (AmazonClassics Edition),"The orphaned Jane Eyre has emerged a fiercely independent young woman. As governess at Thornfield Hall, she’s found her first real home—though it stands in the shadow of the estate’s master, Mr. Rochester, and its haunted halls ring with maniacal laughter. For even the grandest houses have secrets.
As much a story about defying convention as it is about coming-of-age, Jane Eyre remains one of the most beloved novels in the English language. Both Gothic and Victorian in its influence and scope, it captures one woman’s determination to live life on her own terms—choosing courage over fear, while finding power in love and compassion."
The Lost World (AmazonClassics Edition),"There’s only one way for Professor George Edward Challenger to prove that dinosaurs still roam the earth. He invites skeptical journalist Edward Malone to accompany him and a group of adventurers to see the creatures with his own eyes. But when they arrive at the fantastic volcanic plateau in the Amazon where time stands still, their expedition quickly becomes one of survival.
With its cliff-hanging escapes, rousing humor, and nailbiting suspense, The Lost World is a pioneering work of fantasy-adventure that paved the way for every thrill ride to follow.
AmazonClassics brings you timeless works from the masters of storytelling. Ideal for anyone who wants to read a great work for the first time or rediscover an old favorite, these new editions open the door to literature’s most unforgettable characters and beloved worlds."
North and South (AmazonClassics Edition),"When a crisis of faith prompts his departure from the Church of England, Margaret Hale’s father moves his family north to bleak, industrial Milton. At first, Margaret is put off by the town’s grit and poverty—a stark contrast to her rural southern hometown. But when she is awakened to the suffering of Milton’s hardworking citizens, she makes it her mission to improve their lives. However, Margaret soon finds herself at odds with the man she is falling in love with—the handsome, bullheaded industrialist John Thornton.
Skillfully told, North and South is not only an illuminating novel of its era but an enchanting love story that is sure to linger in the hearts of readers long after the last page.
AmazonClassics brings you timeless works from the masters of storytelling. Ideal for anyone who wants to read a great work for the first time or rediscover an old favorite, these new editions open the door to literature’s most unforgettable characters and beloved worlds."
Hamlet (AmazonClassics Edition),"When Prince Hamlet returns home to Elsinore Castle for his father’s funeral, he discovers that his uncle Claudius has already crowned himself king. Hamlet begins to suspect something is indeed rotten in the state of Denmark, and a visit from his father’s ghost confirms it. Hamlet vows to avenge his father’s murder, but his consuming obsession yields only crushing grief, overwhelming rage, and a descent into madness.
Resonating with every generation over the centuries, Shakespeare’s profoundly chilling family drama is among the most quoted works from the Shakespearean canon.
AmazonClassics brings you timeless works from the masters of storytelling. Ideal for anyone who wants to read a great work for the first time or rediscover an old favorite, these new editions open the door to literature’s most unforgettable characters and beloved worlds."
The Scarlet Letter (AmazonClassics Edition),"The red letter A on her dress marks young mother Hester Prynne among her Puritan neighbors, who demand to know who fathered her child. Rumors swirl, but the shunned and shamed Hester keeps her secret—and his—for years, until a guilt-ridden confession reveals the truth, with unexpected consequences.
Set in seventeenth-century Massachusetts, Hawthorne’s masterwork was originally subtitled “a romance,” though its themes include the limits of law, the power of religion, and the nature of sin. Equal parts tragic love story and social commentary, The Scarlet Letter brings to life the undying human need to keep secrets."
Meditations (AmazonClassics Edition),"Marcus Aurelius, one of the great rulers of the Roman Empire, sets forth a series of self-reflective essays intended as a guide for his own self-improvement. Written during the turning points of his life and divided into twelve books, Meditations ponders life’s greatest questions in the author’s search for a meaningful existence. Remarkably, they are no different from the questions we ask ourselves today—from finding happiness to understanding our place in the cosmos.
Centuries after Aurelius’s death, Meditations remains a profound source of inspiration for contemporary times—a collection of deeply held principles that are a wellspring for positive thinking and leading a purpose-driven life."
Great Expectations (AmazonClassics Edition),"Raised in squalor in the marsh country of Kent, the orphan Pip is taken under the wing of the eccentric and reclusive Miss Havisham—only to blindly give his heart to the dowager’s beautiful but ice-cold adopted daughter, Estella. Even as a mysterious benefactor helps to shape Pip’s life into one of fortune, success, and self-discovery, the unspeakable secrets of his unrequited love continue to haunt him—and promise to change his life once again.
With its indelible cast of characters, immersive epic narrative, and startling dramatic twists, Charles Dickens’s powerful classic continues to enthrall generations of new readers."
The Iliad (AmazonClassics Edition),"After nine years fighting the Trojan War, the Greeks sense imminent defeat. The gods have cursed them with a plague; the Trojans have set their ships on fire; and their best warrior, the impenetrable Achilles, has turned his back on them. But when the Trojans go too far and kill Patroclus, his beloved brother-in-arms, Achilles returns to the battlefield with a vengeance so terrible that it shocks even the gods.
Written by Homer more than twenty-five hundred years ago, The Iliad is among the oldest extant works of Western literature—the seminal epic narrative of infantry combat, the scars of battle, and the inevitability of fate.
AmazonClassics brings you timeless works from the masters of storytelling. Ideal for anyone who wants to read a great work for the first time or rediscover an old favorite, these new editions open the door to literature’s most unforgettable characters and beloved worlds."
The Prince (AmazonClassics Edition),"Direct and coldly pragmatic, Niccolò Machiavelli’s The Prince is the preeminent guide to winning and maintaining power at the highest levels, where deception and manipulation are necessary tools, and political allies should never be mistaken for friends.
Once a foreign policy official in his native Florence, Machiavelli was ousted by the Medici family. After surviving disgrace and torture at their hands, he penned The Prince to garner their favor. While this effort was ignored, the five-hundred-year-old work endures and is now considered one of the most influential—and controversial—political treatises of all time."
The Time Machine (AmazonClassics Edition),"A scientist and gentleman inventor in industrialized Victorian England claims to have irrefutable proof that time is not simply a concept—it’s a whole other dimension. When he reveals the prototype of a time-traveling machine to his peers, he’s met with skepticism at first…until he returns one week later, disheveled, bloody, and with a fantastic story to tell.
A cornerstone of speculative science fiction, The Time Machine launched the time-traveling genre, influenced generations of writers, and is recognized as a prescient vision of twenty-first-century fears—those of an impending environmental nightmare and the irreversible fate of a dying planet.
AmazonClassics brings you timeless works from the masters of storytelling. Ideal for anyone who wants to read a great work for the first time or rediscover an old favorite, these new editions open the door to literature’s most unforgettable characters and beloved worlds."
Treasure Island (AmazonClassics Edition),"Peg-legged pirates, colorful parrots, and plundered riches—they’re all here in Robert Louis Stevenson’s original seafaring adventure.
When young Jim Hawkins decides to follow a map to buried treasure, he must befriend or outsmart memorable characters such as pirate Long John Silver, captain Billy Bones, and island man Ben Gunn. Mutinous plans, mysterious deaths, and a tangle of double crosses keep Jim guessing all the way to the prize.
Inspired by real-life seafarers, Stevenson captures the adventurous spirit of the times and the imagination of readers, young and old alike."
